### ISSUE TITLE
IP problem within Docker container

### ISSUE THREAD

**Issue by DatPenguin** [mattermost/mattermost-plugin-calls#546]
Hi,

I am running this plugin within a Mattermost installed as a part of a GitLab container.
I have set the following lines within `config.json`, and checked they appear in the GUI too (they do):
```
"tcpserveraddress": "MY_LAN_IP",
"tcpserverport": 8443,
"udpserveraddress": "MY_LAN_IP",
"udpserverport": 8443
```

However, when I look at the logs, here is what I see:
```
gitlab-web-1  | 2023-10-06_10:04:38.04936 nginx{"timestamp":"2023-10-06 10:04:38.049 Z","level":"info","msg":"rtc: server is listening on udp 172.23.0.2:8443","caller":"app/plugin_api.go:973","plugin_id":"com.mattermost.calls","origin":"main.(*logger).Info log.go:95"}
```
`172.23.0.2` is the IP of the Docker container Mattermost is running in.

I tried to capture the packets exchanged when I start a call, and here is what I get:

**On the machine hosting Mattermost**
```
12:18:20.808081 IP MATTERMOST_LAN_IP.8443 > WAN_IP.50056: UDP, length 100
12:18:21.009172 IP MATTERMOST_LAN_IP.8443 > CLIENT_LAN_IP.50591: UDP, length 100
12:18:21.009303 IP MATTERMOST_LAN_IP.8443 > WAN_IP.55723: UDP, length 100
12:18:21.009372 IP MATTERMOST_LAN_IP.8443 > WAN_IP.50056: UDP, length 100
12:18:21.210503 IP MATTERMOST_LAN_IP.8443 > CLIENT_LAN_IP.50591: UDP, length 100
12:18:21.210608 IP MATTERMOST_LAN_IP.8443 > WAN_IP.55723: UDP, length 100
12:18:21.210685 IP MATTERMOST_LAN_IP.8443 > WAN_IP.50056: UDP, length 100
12:18:21.412016 IP MATTERMOST_LAN_IP.8443 > WAN_IP.55723: UDP, length 100
12:18:21.412109 IP MATTERMOST_LAN_IP.8443 > WAN_IP.50056: UDP, length 100
```
**On the client machine**
```
12:18:21.217897 IP CLIENT_LAN_IP.58557 > 172.23.0.2.8443: Flags [S], seq 1948960305, win 65535, options [mss 1460,nop,wscale 6,nop,nop,TS val 842160450 ecr 0,sackOK,eol], length 0
12:18:21.217898 IP CLIENT_LAN_IP.58555 > 172.23.0.2.8443: Flags [S], seq 3178177447, win 65535, options [mss 1460,nop,wscale 6,nop,nop,TS val 3861289601 ecr 0,sackOK,eol], length 0
12:18:21.219039 IP CLIENT_LAN_IP.58559 > 172.23.0.2.8443: Flags [S], seq 377960354, win 65535, options [mss 1460,nop,wscale 6,nop,nop,TS val 3833219134 ecr 0,sackOK,eol], length 0
12:18:21.310507 IP CLIENT_LAN_IP.50056 > 172.23.0.2.8443: UDP, length 112
```

I believe the wrong IP is used by the plugin.

**Comment by DatPenguin** [comment]
That seemed to be an internal problem.
